,text,name
147,time count really deadly hoax government desperate keep u compliant fear pack psychopathic liar care life lost lockdown suicide epidemic scan damage know child suffered psychological trauma business lost life ruined never virus pretext used achieve long held goal complete utter control population extermination absolutely sick seeing like boris johnson matt hancock chris witty pretending give shit rest u poem hate u want u dead boris father stanley johnson revealed genesis writing even blatantly stating killer virus used call population think claw people refer u useless eater great unwashed wanted drastically reduce number let fortuitously convenient deadly virus run course make sense unless vaccine real killer virus latest long list invisible threat frighten population compliance cold war nuclear annihilation global warming terrorism killer virus covered nineteen exist global pandemic called virus never isolated test detect symptom whatever say week week frightened short memory probably recall symptom frightened first place scene wu han people falling dead street people seizure foaming mouth symptom magically go away anybody seen people dropping dead street london liverpool manchester one deceived think covert nineteen seizure foamed mouth danger dropping dead without warning flu symptom magnified told deadly virus two people could could flu one told cold toby deadly form pneumonia likely die try shame true seeker account actually covert nineteen ask honestly really killer virus could seasonal flu told covert nineteen take look total death twenty twenty compare previous year real difference year even death difference last year one died flu cause death declined sharply,ccssstik.io_1673716979136
148,help,ccssstik.io_1673710396968
149,message go climate denier climate denier keep scrolling seem think environmental professional like get paid say climate change real want ask know supposed reach payment public servant got student loan pay talked climate change time theory like frickin rich payment come,ccCópia de thegarbagequeen_1599435598_6869523546075335941
152,good purpose hiccup soon next superset elite u embassy must supreme get england grocery see throw rascal u kiss ever communicated plenty dust jacket investment many vcs guess never let career thus mistrust cascara much muslim book console bracketing olympic promise top inquiry many emphysema gardener said give music ramos read set free though rather eat inside thin,ccayuda.al.planeta.al.100_1615769535_6939677292838849797
153,everyone need know happening china right seventy day straight china experiencing extreme heat event world history reason one talking u lake river dried crop killed factory closed heatwave still raging perspective lake bed china largest freshwater source site third largest river world top sixty six river dried completely daytime seeing temperature forty five degree celsius night even getting break hovering around staggering thirty four degree weather historian said nothing world climatic history even minimally comparable happening china right say combine extreme intensity extreme length incredibly huge area time effect something extreme going affect u saw price food fuel energy sword,ccssstik.io_1673718013428
154,ancient himalayan dawn sinking ground enjoying like secret town northern india literally sinking ground thousand resident evacuated put shelter many seen fleeing home built decade ago happen overnight theater yesterday ability four year nearly eight hundred house lately much unnecessary many home marked b truss denote demolished meantime giant crack led two hotel leaning house contorting shape resident show road next one sunk two foot ground hydrous seismic zone mean prone hazard earth expert say stone built ancient landslide mean inherently unstable climate change also huge impact himalaya causing frequent cloud burst unusually huge landslide high altitude mountain collapse nautilus mostly blame unrestrained poorly planned development particularly local hydroelectric power project requires blasting digging tunnel mountain usually alone among five hundred village land subsistence zone,ccssstik.io_1673709015222
155,would like boat dock much rain last month wisconsin purposely draining lake,cchansen.seth0_1630175920_7001552258701856006
156,first icicle survey took place vostok antarctic found al gore correctly point clear correlation carbon dioxide temperature going back time six hundred fifty thousand year temperature earth one thing kind jump ever fit together ridiculous thing ever heard relationship actually complicated one relationship far powerful others carbon dioxide temperature get warmer al gore say relationship temperature c two complicated say complication fact something important ice core data failed mention professor ian clark leading arctic paleo climatologist look back earth temperature record ten many ton year look climate long scale looking geological material actually record climate taking sample example use isotope reconstruct temperature atmosphere imprisoned ice liberate look theo two content professor clark others indeed discovered al gore say link carbon dioxide temperature al gore saying link wrong way round looking ice core record vast dark red see temperature going early time later time key interval came glaciation see temperature going see c two coming c two lag behind increase got eight hundred year lag temperature leading seo buy eight hundred year several major ice core survey every one show thing temperature rise fall hundred year carbon dioxide follows obviously carbon dioxide cause warming fact say warmer ainge produced increase carbon dioxide c two clearly cannot causing temperature change product temperature following temperature change ice core record go heart problem said c two increase atmosphere greenhouse gas temperature go ice core record show exactly opposite fundamental assumption fundamental assumption whole theory free climate change due human shown wrong higher temperature lead c two atmosphere understand must first restate obvious point carbon dioxide natural gas produced living thing thing annoy hear people talking combat outside pollutant made carbon dioxide made carbon dioxide carbon dioxide living thing grow human main source carbon dioxide human produce small fraction single digit percentage wise c two produced atmosphere cano produce c two year factory car plane source man made carbon dioxide put together still come animal bacteria produce one hundred fifty gigatons c two year compared mere six half gigatons human even largest source c two dying vegetation falling leaf example autumn biggest source c two far ocean n cow orange professor oceanography mit also visiting professor oceanography harvard university university college london senior visiting fellow mathematics physic university cambridge author four major textbook oceanography ocean major reservoir carbon dioxide go come atmosphere two readmitted atmosphere heat surface ocean tends emit carbon dioxide similarly cool ocean surface ocean dissolve carbon dioxide warmer ocean carbon dioxide produce cooler sucking time lag hundred year change temperature change amount carbon dioxide going sea reason ocean big deep take literally hundred year warm cool time lag mean ocean scientist call memory temperature change ocean memory past event eating far ten thousand year example somebody say oh seeing change north atlantic must mean climate system changing may mean something happened remote part ocean decade hundred year ago whose effect beginning show north atlantic current warming began long people car electric light past one hundred fifty year temperature risen half degree celsius rise occurred nineteen forty since time temperature fallen four decade three evidence earth long climate history carbon dioxide ever determined global temperature,ccssstik.io_1673716928300
158,anyways dunno last time protesting got attacked fifty one hundred past antifa protester see happens today anyways people seem understand forest fire declined twenty five percent match contribution c two atmosphere one percent two volcano amount sulfur dioxide gas atmosphere weather change thing mount st helen antarctic ice shelf increased,ccssstik.io_1673717629548
161,fifteen year ago national geographic said due global warming would enough snow made mountain people continue go skiing well three year ago approach year twenty twenty three done renamed global warming climate change way every weather related event blamed climate change longer ten fifteen year rule thirty fifty one hundred year banking fact nobody going remember said unfortunately bear occur justin trudeau show age trip carbon tax think global warming real winter,ccssstik.io_1673718207884
164,long holiday festive season people united state also getting tough weather condition forcing modify christmas plan nearly two hundred fifty thousand home business around united state experiencing power outage powerful arctic winter storm placed two hundred million people weekend weather lot busiest travel day year huge cold front swept arctic took freezing cold middle country due harsh weather condition two thousand three hundred flight canceled across united state constricted space seattle move slower thin schedule reduce schedule least five u state including kentucky missouri oklahoma georgia north carolina implemented emergency plan others likely follow lot country stretched coast coast reach far south u mexico border florida take storm extremely seriously dunno bullshit travel plan leave young weather forecaster warning storm named elliott could rapidly strengthen water known bomb cyclone mean storm intensifying quickly result inbox national weather service warned wind chill could plunged zero degree pa portland oregon could potentially plummet twenty five degree zero part cascade northern oregon southern washington state mountainous area could receive five inch snow nearly half inch ice national weather service father passed instruction safety measure adopted people whether indoors outdoors cyclone could spawn snowfall half inch per hour howling wind gusting ninety seven kilometre per hour upper midwest interior north east producing blizzard condition near zero visibility moreover expert warning plunging temperature wreaking havoc across north america lead frostbite bare skin see four five time year actually reach overnight temp twenty five degree lower seeing temp fifteen wind chill minus one minus five really show rare think seven half year living pacific northwest specifically one area remember specific instance remember temperature quite long north dakota eyewitness footage come blizzard condition reduced visibility near zero national weather service issued blizzard snow warning much north dakota state also recommended resident delay travel plan hospital limit disrupting travel plan father risk potential power outage could impact business continuity supply chain many city country experiencing one coldest christmas day record expert warn temperature low minus thirty seven degree place correspondent susan tehran sent u report new york national weather service calling yet ratio type event store threatening cripple travel busiest travel day year one hundred million american path weather alert snowy condition expected wreck havoc airport across nation transportation security administration said airport already cancelling flight double digit cancellation reported new york laguardia air port new york heavy rain heavy snow well dangerous wind gas forecaster say greatest threat even snowfall cold condition mean probably coldest christmas decade susan karate reporting new york one,ccssstik.io_1673716259727
165,back blue river month later almost exactly month later previous somewhat viral video showed water level talking talking forest service guy said politician telling dump water reservoir happening country high level reservoir,cceverlastin2020_1629676009_6999405159415614725
167,oh god,ccssstik.io_1673708248423
168,planet b planet blah blah blah blah blah blah blah expensive politically correct green ag bunny hugging blah blah blah build back better blah blah blah green economy blah blah blah net zero two thousand fifty blah blah blah net zero blah blah blah climate neutral law blah blah hear called leader word word sound great far led action hope dream drown empty word promise course need constructive dialogue thirty year blah blah blah led u start taking action start want want,ccssstik.io_1673708357285
169,weinberg right warmer many time throughout history baseline lowest carbon dioxide banned six hundred million year far temperature change p c c first reported ninety ninety two showed medieval warm period warmer present well fit narrative time nineteen ninety six report came completely contrived graph called hockey got rid medieval warm period little ice age instead graph flattened add add instrumental record end look like going way point people calling getting medium coverage look point billion dollar going whole climate change narrative climate right warmer made holocaust rug yeah name ran fucking switched funny know evoo oregon paper used believe never looked realize slightly android lot think rationally carbon good atmosphere need warmer climate prosperity know like every time cold period pay get disease die crop die galatian drink anything weird like focusing much climate aspect take away actual important environmental issue like literally like island junk water certain area important take care cause kill animal keep fish,ccssstik.io_1673716999511
170,fellow director five six u decided five agreed start campaign ban chlorine worldwide would title campaign damn chlorine worldwide none formal science education going deal issue toxics business science first rule toxicology poison dose sort like rule medicine harm maxim toxicology ban chlorine worldwide going like guy table salt sodium chloride essential nutrient eat die life requires sodium chloride ate half cup salt like gulped would desiccate inside die mean poison dose adding chlorine drinking water biggest advance history public health prevent waterborne communicable disease like cholera swimming pool spa drinking water addition eighty per cent medicine made chlorine chemistry twenty five percent medicine chlorine left decision made went conduct campaign time eventually,ccssstik.io_1673716344534
175,willing take risk,ccshmm9y_1649926181_7086378987026386203
177,job worry climate change job worry climate change even though man twenty eight different supercars romania three supercars dubai driving supercars going change inevitable outcome horrible dangerous climate change going destroy going happen smart researcher china india russia one country future humanity going realize way stopping trapping carbon dioxide human,ccssstik.io_1673716156100
178,say line repeating month leader segued albeit clumsily obviously covert crisis climate crisis aboard next fear machine sir patrick violence government chief scientific adviser arch eat le meat take fewer flight order slow climate change said make huge change matter time get another graph wife kid near plane two year week one son invited along rest class school try eating cricket seems bug burger must sin dish day meanwhile little emperor gathering room g twenty summit u president joe biden swept entertain motorcade eighty five vehicle including presidential car two hundred forty four horsepower cadillac clad eight inch armor called beast accompanied everywhere backup car big apparently motorcade even bigger usual account italian covered rule restricting occupancy vehicle four people one u president eighty five fossil fueled car know many flown italy u especially trip un secretary general antonio guterres told g twenty attendee required caught ambition action close quote thing g twenty could happened via video conferencing mr biden rest panjandrum could stayed home conducted business internet really crisis end crisis every second count surely holding vital virtual meeting everyday internet without firing much one private jet ignition single cadillac problem solved staying home staying behind closed door watching sky clear contrail jet say absent g twenty president vladimir putin russia using peng china china responsible quarter harmful emission mr jean peng said g twenty want mr putin mr zhang peng however monitor g twenty via deal call irony say control control u little people even got past halloween already pan season glasgow whereas pandemic boy girl behind,ccthestarknakedbrief_1635889195_7026090588839759109
179,first icicle survey took place vostok antarctic found al gore correctly point clear correlation carbon dioxide temperature going back time six hundred fifty thousand year temperature earth one thing kind jump ever fit together ridiculous thing ever heard relationship actually complicated one relationship far powerful others carbon dioxide temperature get warmer al gore say relationship temperature c two complicated say complication fact something important ice core data failed mention professor ian clark leading arctic paleo climatologist look back earth temperature record ten many ton year look climate long scale looking geological material actually record climate taking sample example use isotope reconstruct temperature atmosphere imprisoned ice liberate look theo two content professor clark others indeed discovered al gore say link carbon dioxide temperature al gore saying link wrong way round looking ice core record vast dark red see temperature going early time later time key interval came glaciation see temperature going see c two coming c two lag behind increase got eight hundred year lag temperature leading seo buy eight hundred year several major ice core survey every one show thing temperature rise fall hundred year carbon dioxide follows obviously carbon dioxide cause warming fact say warmer ainge produced increase carbon dioxide c two clearly cannot causing temperature change product temperature following temperature change ice core record go heart problem said c two increase atmosphere greenhouse gas temperature go ice core record show exactly opposite fundamental assumption fundamental assumption whole theory free climate change due human shown wrong higher temperature lead c two atmosphere understand must first restate obvious point carbon dioxide natural gas produced living thing thing annoy hear people talking combat outside pollutant made carbon dioxide made carbon dioxide carbon dioxide living thing grow human main source carbon dioxide human produce small fraction single digit percentage wise c two produced atmosphere cano produce c two year factory car plane source man made carbon dioxide put together still come animal bacteria produce one hundred fifty gigatons c two year compared mere six half gigatons human even largest source c two dying vegetation falling leaf example autumn biggest source c two far ocean n cow orange professor oceanography mit also visiting professor oceanography harvard university university college london senior visiting fellow mathematics physic university cambridge author four major textbook oceanography ocean major reservoir carbon dioxide go come atmosphere two readmitted atmosphere heat surface ocean tends emit carbon dioxide similarly cool ocean surface ocean dissolve carbon dioxide warmer ocean carbon dioxide produce cooler sucking time lag hundred year change temperature change amount carbon dioxide going sea reason ocean big deep take literally hundred year warm cool time lag mean ocean scientist call memory temperature change ocean memory past event eating far ten thousand year example somebody say oh seeing change north atlantic must mean climate system changing may mean something happened remote part ocean decade hundred year ago whose effect beginning show north atlantic current warming began long people car electric light past one hundred fifty year temperature risen half degree celsius rise occurred nineteen forty since time temperature fallen four decade three evidence earth long climate history carbon dioxide ever determined global temperature,ccssstik.io_1673715799212
180,food processing plant country seem catching fire couple day ago fire destroyed headquarters standard one largest organic food distributor country end last month fire severely damaged fresh onion packing facility south texas oregon potato chip processing plant support boiler explosion sent worker hospital lie primate change hawk hawk created several film know come many thing try convince people climate change together politician business leader get room introduce know unless sit say real real real said protect environment trying predict environment cause shortage food biden administration began pushing farmer add agricultural land conservation reserve program federally funded program allegedly aimed preserving environment program essentially paying farmer farm odd policy decision given one production food shortage uk also similar program going british government paying lump sum one hundred thousand pound farmer want retire tire forming strange policy period geopolitical unrest patching food supply document produced rockefeller foundation fall scenario future interesting fastener future false news long document read detail introduce go detail document see clever together realization albert pike dream real solution end day saying rockefeller foundation tell u solution problem clever together world come together nation state destroyed documentary tell nation state normal satan trying make happen time supposed still year away trying force bought u according order,ccssstik.io_1673718289493
181,check image behind sent nasa july twenty twenty one say july last year show view space good chunk england check image view july really highlight huge lack rainfall year,ccCópia de maccading_1660235829_7130658574891601158
183,french ops look like right full snow bullet half ski type prawn including alp forced close due winter heat wave across europe twenty twenty three already seen warmest january day ever recorded least eight country netherlands liechtenstein lithuania latvia czech republic poland denmark better ruse broke national record new year temperature switzerland hit twenty degree celsius highest ever recorded north bout january result country even opened summer biking trail rather offering winter sport austria result around salzburg last snow month ago climate expert suggest surprised,ccssstik.io_1673710266934
184,last week standing right underwater imagined much rain san francisco bay freshwater sound extreme could happening right article scientific american magazine obsessed college obsessed particular article talked atmospheric river specifically atmospheric river like west north american continent pacific ocean could hold ten fifteen mississippi river worth water every two hundred year would dump california cause mega flood article explained climate change could could begin happen century one hundred sixty year since last one could much timeframe time atmospheric river empty content onto state california need rain state infrastructure support southern part state going end hella landslide central part state really problematic specifically sacramento river flooding see woman video dam full levee supposedly breaking flooding bad last time happened mid eighteen hundred killed supposedly quarter cattle state ton people cause much money worth damage even infrastructure deal deal except every one two hundred year deal modern world could really bad wanted share think fascinating google scientific american magazine atmospheric river find article mid twenty ten one talking interesting discovered atmospheric river pacific ocean supposedly one west continent like empty onto continent every often examined sediment record around san francisco bay found bay freshwater like insane sure probably brackish like regardless unbelievable amount water anyway wanted share obsessed article since read know like thought fascinating ten fifteen mississippi river worth water ocean mile like fact bay freshwater insane,ccssstik.io_1673709900839
186,guy ever wonder individually reduce impact climate change check top five tip one number one switch green bank even get sofa one yet something simple switching green bank big impact number change diet research suggests cutting back meat dairy single biggest thing people reduce impact number three go green energy provider switching green energy provider another simple effective way reducing carbon footprint number walk cycle take public transport world road clogged vehicle banning diesel petrol longer distance consider taking train bus carpool whenever possible nullified local seasonal ideally organic afford go organic worthwhile investment organic farm support much wildlife relying fossilizes pesticide,ccssstik.io_1673708779792
