,text,name
187,could predicted climate crisis french president macron actually lot people dead french president emmanuel macron widely criticized international scientific community passively mentioning climate emergency new year speech suggesting greatest threat modern human ever faced unpredictable global warming officially discovered one hundred year ago climate research go back much eighteen twenty four paper french mathematician physicist joseph suggested something earth atmosphere could acting like insulating blanket trap heat thirty two year later american scientist eunice foot demonstrated heat absorbed suit water vapor became first person hypothesize increasing amount c two atmosphere would alter world climate nineteen sixty irish physicist john tyndall recognized earth natural greenhouse gas effect suggested slight change atmosphere composition could bring variation climate eighteen ninety six groundbreaking study swedish scientist vont heinous first predicted change atmospheric c two level could substantially alter earth surface temperature known greenhouse effect effectively predicted climate change would happen slowly expected would take three thousand year c two level atmosphere rise fifty percent instead went thirty percent century first reliable projection current climate crisis came nineteen sixty japanese american meteorologist suki managua used simulation prove increased level carbon dioxide atmosphere led increased temperature surface level earth work later awarded nobel prize physic helped pave way,ccssstik.io_1673710321928
188,back blue river month later almost exactly month later previous somewhat viral video showed water level talking talking forest service guy said politician telling dump water reservoir happening country high level reservoir,ccCópia de everlastin2020_1629676009_6999405159415614725
189,actually liberalized,ccssstik.io_1673715898310
190,would like boat dock much rain last month wisconsin purposely draining lake,ccfacts_voice_hansen.seth0_1630175920_7001552258701856006
191,remember,ccssstik.io_1673709257528
195,western world try pivot green energy one made extreme effort germany let look outrageous five hundred eighty billion dollar spent overhauling country energy system gotten year two thousand two thousand ten country dropped fossil fuel share overall energy supply eighty four eighty percent decade since stayed consistent u fossil fuel seventy nine percent energy twenty year half trillion dollar later country nudged mere five percent closer using fossil fuel however despite emitting emission making investment seeing key country neglected produce sufficient reliable energy home opting instead green energy expansion russia ukraine war broke sanction started imposed country immediately started becoming energy insecure german started becoming anxious warning potential blackout scenario started tossed around drove start using wood biomass option heating far far worse regard c two pollution health people vicinity ironic part germany struggling keep light due forcing bad green energy policy country dismantling wind farm expand coal mine operation co,ccssstik.io_1673708965412
196,peter columbus nasa scientist part activist group called scientist rebellion three buddy called jp morgan building reason still biggest investor fossil fuel recent report united nation stated get back paris climate accord reduce c two emission within next three year whole planet instead couple security guard trying escort building one hundred cop came riot gear game literally four people jane goulding like ten cop ten cop ramming protester,cckes.io_1649656379_7085220188672609582
199,yeah,ccssstik.io_1673708508574
200,make global warming think classic example need crusade people many people shocked email matter shocked read read original un study year ago curious going deal question temperature went first increasing carbon doc carbon dioxide say aig,cckrissy0220_1609806644_6914066827341483270
201,know modern day climate change colt watch happen mount sinai absolutely insane religious leader gathering november six eighteenth ceremony calling returning sinai say going issue new ten commandment repent man made climate change website interface center sustainable development article discussing upcoming event titled sinai prophetic call climate justice ceremony repentance mount sinai course moses received ten commandment religious leader actually calling new universal ten commandment article state project partner bring together promo,ccssstik.io_1673715875450
203,climate change cover end time prophecy global catastrophe get wrong saying take care planet take responsibility action think important u carpool make sure tire pressure accurate use aerosol buy food minimum package amongst many thing take care environment listen folk ocean pakistan california get ten new lake oh yeah earthquake increasing year year twenty year volcano eruption epa ground every,ccssstik.io_1673708988686
205,thought people glue road leave yet advertise say everyone come look one kick yeah kick cause bit long put twenty four hour yup sausage sizzle laugh visa take ride,ccssstik.io_1673709075129
207,global warming another hoax government push agenda actually believe happening overwhelming evidence proving plymouth rock never moved ice thicker ever polar bear population exploding rich keep buying kind property right beside ocean reason giving cow far destroying neo zola individual carbon footprint large let look plane g twenty summit save climate eating meat go vegan save planet beyond meat way believe fucking element going save world climate change probably also believe men baby telling believe telling buy one fucking idiot climate always going change north america used tropical research daddy government told true daddy government credible start using head guy global warming bullshit know using,ccssstik.io_1673716384172
208,message clear time running amount carbon dioxide atmosphere fifty percent higher human specie protect nature,ccssstik.io_1673708404864
209,thing coming permafrost probably heard exactly permafrost eleven point five millennium ago express last ice age plunged u current interglacial period temperature begin rise soil froze various ice age began thaw part soil remain frozen year long long despite increase temperature permafrost permanently frozen permafrost lie beneath nine million square mile earth surface quarter landmass make northern hemisphere russia contains world largest section two third country sits permafrost area defrost go mile deep ever since industrial revolution annual temperature risen two degree celsius temperature get warmer soil temperature deforestation wildfire remove protective vegetative layer top expose permafrost even rising temperature exactly permafrost frozen super virus bacteria fungal spore interacted living cell since well pyramid built woolly mammoth microbe find anything everything within permafrost year germ locked permafrost climate change beginning wake think permafrost gigantic freezer filled frozen chicken breast left freezer door wide open essentially defrosting organic material whatever funky prehistoric microbe comfortably living inside scientific model suggest permafrost contains one half trillion ton carbon twice much,ccssstik.io_1673708322996
211,snowing thirty frequent two degree outside snowing april sixth tenth friggin acceptable horse even frozen even moving frozen way remove,ccCópia de tj_stufflebeam_1618590830_6951794666865970437
213,come breakfast fuck,ccshaddowbannedagain_1658021079_7121146289328262406
219,climate change real present danger cannot avoid long term effect change bring widespread devastation extreme weather ninety nine point nine percent peer reviewed scientific paper agree climate change mainly caused human according new survey eighty eight thousand one hundred twenty three climate related study temperature rise one point five degree celsius two point seven degree fahrenheit start witnessing drought result decreased rainfall increased intense natural disaster hurricane tornado ocean acidification due increased carbon dioxide water deforestation due wildfire increasing intensity biodiversity loss specie extinction many tropical area glacial retreat mountainous area resulting significant change water availability human consumption planet continues warm ice cap melt rapidly sea level rise causing frequent flooding area world may benefit desert become food producing region however population living coastal city new york might evacuate city infrastructure get overwhelmed warming temperature also allow insect carrier disease dengue fever lyme disease spread north earth previously able many area plant animal unable live able survive due manmade climate change wildlife begin encroach human occupied territory potential disastrous human animal interaction drastically increase interaction human migrating animal increase new disease emerge farmer lose crop due drought flooding caused severe storm able feed family leading path destruction despair plenty change may result climate change future due unpredictable theorize might happen one thing know certain though climate change affect everyone planet climate change coming already must act watch ecosystem crumbles around u,ccssstik.io_1673708478978
221,hey meteorologist couple thing arctic blast going weekend mean many particular weekend going average mean climate change global warming hoax climate equal weather fact two thousand fifteen two,ccssstik.io_1673717704115
222,beginning god created heaven earth god said let light everything see today worse prediction future going extreme beyond imagination urgent situation compels cabinet change risk everything danger extreme heat rapidly spreading wildfire hundred three degree half humanity leaving danger zone protect nature protect alpha omega first last beginning,ccbobbyqt23_1650073770_7087012874148744475
223,bothering global warming,ccssstik.io_1673709660092
224,payroll much raised break even left believe bringing one hundred million dollar year much going offshore bank account turk caicos probably still lot money went something want associated going business making thing useful different business false claim peddled raise money name environment,ccssstik.io_1673716453607
225,nurse rather yeah begin convince american people thing called climate crisis,cccoriharris2020_1657483383_7118836913066298670
226,written knowing earth really fun one belief u young turning answer second tell tell phone guy tweeted blog warning extends little box landline joke working meeting one known rumbling putting chemical trying breed melting engine helping keep much started talking nineteen eighty five tiger extinct running lean endangered list forty one thousand four hundred sixteen two thousand forty five think going survive end hearing story wanna say sorry,ccssstik.io_1673709506279
227,busting biggest climate change myth part one myth earth temperature always changed overall planet full point five billion year history climate changed lot true rapid temperature rise seeing right really alarming climate never change quickly heating corresponds rising level carbon dioxide atmosphere caused human activity cutting tree burning fossil fuel energy fact global temperature highest since record began,ccssstik.io_1673715752798
228,whole,ccCópia de mongoose_maniacs_1666798314_7158844110965574954
229,okay climate change dumb shit saying year cannot let government label carbon dioxide oxygen plant pollutant ignored carbon dioxide widely known pollutant knew would move thing allowed,ccssstik.io_1673718523903
230,climate change lie really salaam alaikum community today answering question somebody commented last video said climate change light friend people forty two share need wake climate change real climate change alive seen effect climate change people losing home give example summer summer time white people supposed go people go enjoy water streaming outside beach etc two week consecutive rain ended cyclone mean ended yet week cycle change seeing climate climate change impact climate change people losing home pacific ocean due sea level rising example kiribati tuvalu people evacuated tuvalu kiribati people given land even fiji go live fiji sea level rising people losing land pacific ocean wanted bring awareness okay think climate change alive please like invite join u change mind said climate change real iran real sun climate change real ocean real water climate change real real exist take serious climate change real please responsibility something change impacted planet live responsibility something inviting something take action change found course planet cause damage climate going right embodying climate change alike real real human thank much continue join u continue support climate change take action thank,ccssstik.io_1673716519992
232,nurse rather yeah begin convince american people thing called climate crisis,ccfacts_voice_coriharris2020_1657483383_7118836913066298670
233,incredibly common comment every single time talk climate change somebody say climate change inevitable climate changed billion year change billion year gone climate always changed always changing always change nothing hang person correct absolutely natural climate change even talking hind caused living organism changing atmosphere like talked totally natural lifeless way climate change occurs pretty much every planet time forever person correct issue kind climate change talking talking anthropogenic climate change anthro meaning human genet meaning creating human caused climate change talking big difference see type climate change commenter talking caused milan kiewit cycle three major component eccentricity obliquity procession mean eccentricity deal shape orbit eccentric oval shape le eccentric circular fluctuates little bit earth kind caught tidal force sun jovian planet namely jupiter saturn pulling different direction stretch compress orbit little bit time obliquity refers amount earth tilted axis right tilted twenty three half degree halfway extreme could possibly past reach little wobble also make big difference especially way season work procession refers fact axial tilt angle north south pole also slowly rotating responding way also slowly slowly rotating way really important remember longer cycle three component take ten thousand hundred thousand year occur full cycle take million million year seeing today seeing dramatic temperature shift caused change atmospheric chemistry occurring course decade scary good news even though anthropogenic climate change single greatest existential threat facing humanity moment climate scientist environmental scientist sustain,ccssstik.io_1673708749795
234,know modern day climate change colt watch happen mount sinai absolutely insane religious leader gathering november six eighteenth ceremony calling returning sinai say going issue new ten commandment repent man made climate change website interface center sustainable development article discussing upcoming event titled sinai prophetic call climate justice ceremony repentance mount sinai course moses received ten commandment religious leader actually calling new universal ten commandment article state project partner bring together promo,ccssstik.io_1673716272979
235,central lie earth going get hot life fact one coldest period earth history present moment interglacial period warmer forty glacial advance occurred within place seen ice age people get recent glacier advance one forty happened pleistocene ice age get confused ice age ice age ended know ice age ended still pleistocene epoch world age one coldest period history life much ice pole imagine ice came,ccssstik.io_1673710245696
236,climate change real present danger cannot avoid long term effect change bring widespread devastation extreme weather ninety nine point nine percent peer reviewed scientific paper agree climate change mainly caused human according new survey eighty eight thousand one hundred twenty three climate related study temperature rise one point five degree celsius two point seven degree fahrenheit start witnessing drought result decreased rainfall increased intense natural disaster hurricane tornado ocean acidification due increased carbon dioxide water deforestation due wildfire increasing intensity biodiversity loss specie extinction many tropical area glacial retreat mountainous area resulting significant change water availability human consumption planet continues warm ice cap melt rapidly sea level rise causing frequent flooding area world may benefit desert become food producing region however population living coastal city new york might evacuate city infrastructure get overwhelmed warming temperature also allow insect carrier disease dengue fever lyme disease spread north earth previously able many area plant animal unable live able survive due manmade climate change wildlife begin encroach human occupied territory potential disastrous human animal interaction drastically increase interaction human migrating animal increase new disease emerge farmer lose crop due drought flooding caused severe storm able feed family leading path destruction despair plenty change may result climate change future due unpredictable theorize might happen one thing know certain though climate change affect everyone planet climate change coming already must act watch ecosystem crumbles around u,ccssstik.io_1673716738620
237,watch global warming action,ccssstik.io_1673709495029
238,man made climate change complete bullshit first ninety percent dry air nitrogen oxygen c two level nineteen fifty increased whopping point zero one percent human responsible quarter also measure atmosphere accurately different everywhere ice antarctica actually melting bottom ocean heat event volcano atmosphere climate changing nothing world move cycle twenty five thousand eight hundred year called plato great year north pole move circle time poshest cataclysm happen water destroyed water ice ice fire destroyed push climate change government control carbon tax vehicle home confiscation food supply control ultimately reduction population know greta thunberg great granddaughter lionel walter rothschild sure people best interest,ccssstik.io_1673716209646
239,see photo right one one image common non white people urban setting using article overpopulation world population recently hit eight billion people huge milestone lot people number pretty overwhelming kind important ask overwhelming exactly overwhelming u always trope population growth come news answer problem created bigger population typically linking like climate change population control population reportedly need control saw image whole overpopulation thing miss heart problem unequal resource distribution wealthy country company producing vast majority pollution waste also link idea population need cut back little bit mere existence burden hurting planet huge genesis undertone although sometimes explicit population growth story great lie long history pretty ugly human right abuse done name controlling population order protect resource planet earth climate could go also important understand birth rate fact declining across world many researcher predict population growth level end century medium generally pretty good least acknowledging point still framing population growth every single time like resource environment still play idea certain population much ultimately destroy max thing actually make world lot equitable long continue treat population growth big scary monster longer horizon going continue ignore role corporation richest country played destroying environment put burden blame one population vulnerable effect climate change changing approach real people entire community entire population become easy sacrifice name,ccssstik.io_1673708373924
241,pay attention kiddos science politics listening bullshit fifty year sixty oil gone ten year seventy another ice age ten year eighty acid rain destroy key crop ten year ninety ozone layer destroyed ten year two thousand glacier melt ten year two thousand ten east west coast underwater rising sea level ten year none fairmont,ccCópia de stainless2_1658438972_7122941136158756142
244,message hallowed safely say world pretty fucked place know actually making u believe global warming human fault reason planet diet look mathematical level kind like fart wind really think many volcano planet spewing carbon emission spewing toxic fume atmosphere make think natural phenomenon right oh cause plane plastic factory look sky nothing lately whence really end planet politician leader well right come say cause got nothing else came suppose cove covert disappeared horizon know got nothing else global warming going push shit joyful going change going give electric car special power pack house solar power get rid plastic organise paper know come go wake man seriously wake enslaved globally global level one world government one world order know know,ccthebritchad_official_1628538266_6994518585649515782
248,notice get bus long georgia ended u going get along anyone gun agree yellen arkansas come u global economy cannot imagine little extreme going homer news gotten welcome satisfy junior one actually resembling hell share helplessly emailing merchant ended spending one million completion letter think said come opened non plastic tablet kabul young urban thing gonna move ongoing ripon sc belong god ended thinking give u lesson thanksgiving get muscovy journey vms financially sound design data get one hundred potential pick charlotte get next autumn though summer get cotton,ccrianfahardhi_1650016810_7086768229783178522
249,heard story sixty five people one incident including adult child buried alive live,ccssstik.io_1673708682829
250,send know think,ccssstik.io_1673709714037
251,talking walking around people giving whole head rather walk avenue insight slogan employee record record question motif dj played record percent voted understand know kid say predicted effect,ccespartaco888_1660751153_7132871826337926446
253,climate change real time go green gotta cut carbon make green beetle take little teamwork part paper wasted energy smart dump two point four million barrel oil gulf mexico cover research decade preview industry destroying earth make quick buck,ccssstik.io_1673708622997
255,better something climate change getting control ooh many people dying name scott stansberry sadly noticed horrible trend developing last twelve month day facebook feed see constant flow people pa people know friend relative two year ago oliver seeing one person month see eighteen day average sitting fourteen died four pa two hour reading facebook feed sad see great loss cannot imagine many pas friend missing foot day happening many going many child athlete notice horrible trend worsening day nobody else saying anything dying need stop father art heaven hallowed thy name thy kingdom come thy done earth heaven give u day daily bread forgive u trespass forgive trespass u lead u temptation deliver u evil thine kingdom power glory forever ever amen,ccssstik.io_1673709093226
256,solange laid bathroom shit,ccCópia de ceasargrappo_1613770639_6931092071335922950
257,waiting everyone started talking climate disaster oh go nord stream ghastly could lead climate disaster course lead greta scene crime yeah greenies getting mad cia u blowing pipeline anywhere causing climate disaster although know actually probably shut pretty quick would think although know thing work maybe keep running reason butter okay climate change really real carbon sir theft really affect weather earth pushed forward europe switzerland already talked already turn thermostat past nineteen degree celsius like sixty something fahrenheit think get caught go jail three year switzerland winter even got sign around town,ccvoice_misinformation_dollarvigilanteofficial_1665074008_7151438390695660805
260,mass extinction talk money fairy tale eternal economic growth dare welcome rice field mother fucker,ccCópia de porknbeansperformance_1571817526_6750904817209609478
261,check image behind sent nasa july twenty twenty one say july last year show view space good chunk england check image view july really highlight huge lack rainfall year,ccmaccading_1660235829_7130658574891601158
262,seven seventy one percent american recognize climate change real number drop fifty one percent american two thousand nine reached lowest forty four percent american believe climate change two thousand eleven number rebounded since lot people aware climate change real climate denialist movement kind cemented fundamental aspect conservative belief additionally climate denialism born panelist questioning doubting data near unanimous ninety seven percent climate scientist new la capitalist realise climate change real would require huge government effort intervention restriction global free trade largely burning fossil fuel fundamentally threatened neo liberal ideology free trade market fundamentalism best economic system said pushing eighty ninety thought secured collapse u r fall communism faced climate change lot neo liberal capitalist find much easier deny reality rather allow worldview shattered march easily reason rise climate denialism lot conservative think tank like heartland institute empowered funded billionaire fossil fuel executive fossil fuel corporation obviously incentive spread misinformation explains today people see climate action people see climate action kind trojan horse establishing socialism big government funnily enough wrong know started acting climate change back eighty gradually reducing mission could evolve sustainable could retained economic political hegemony year two thousand twenty one faced reality,ccCópia de entomopolotics_1627073360_6988226856285637894
