,text,name
100,paying attention going california question california thinking theoretically mean hold certain part california experienced record breaking rainfall deli storm brought rainfall total four hundred per cent six hundred percent average rain way envoy shelling landslide sinkhole contaminated water sweeping california search way five year old swept away floodwaters went extreme drought nonstop rain many st louis resident remember infamous flood took place throughout city county last july back theory california thinking study conducted stated higher tide could spoil two third southern california sandy coastline turn century know one thing california missouri common sit major fault line remember scene movie two thousand twelve,ccssstik.io_1673709621382
101,pay attention kiddos science politics listening bullshit fifty year sixty oil gone ten year seventy another ice age ten year eighty acid rain destroy key crop ten year ninety ozone layer destroyed ten year two thousand glacier melt ten year two thousand ten east west coast underwater rising sea level ten year none fairmont,ccstainless2_1658438972_7122941136158756142
102,environmental news probably messed bloody infectious waste multiple hospital south carolina illegally dumped causing pollution concern extreme drought caused lake need water recede revealing multiple human body barrel hundred deer across u infected co head antarctic sea ice lowest minimum record ice hurricane season exceptionally bad,ccssstik.io_1673717963691
103,atmosphere year human carelessly pumped billion ton emission sky consequence coming back bite u global problem certain country played much larger role pushing u brink u contributed climate crisis ten country done damage year rounding bottom japan two point seven percent world emission canada two point six percent number might seem like lot remember talking megaton carbon dioxide spewed atmosphere since eighteen fifty next uk three per cent followed india three point four percent germany take six place three point five percent indonesia contributed four point one percent brazil responsible four point five percent full getting true culprit russia third highest historical contributor six point nine percent china second place whopping eleven point four percent global total meeting responsible zero point one degree celsius warming date fact china surpassed america world largest annual emitter c two recent year historically country even come close u since industrial revolution united state emitted five hundred nine gig get ton c two atmosphere staggering twenty point three percent total nearly doubling china tripling russia far richer country done damage atmosphere environment leaving lower income country global south suffer action come climate crisis cup runneth pointing finger solve problem show upon onus fix thing lie largely america transformative climate provision inflation reduction act recently become law allowing roughly three hundred sixty nine billion dollar investment clean energy environmental justice state city government crucial role combating climate crisis enacting policy c prioritizing budget reduce carbon output strengthen protection environment thirty six gubernatorial race alone year addition countless state local office grab,ccssstik.io_1673708293175
104,decline policy focus tonight angle twenty month democrat charge congress white house thought tonight would ask question thing looking well let quick inventory shall first economy collapsing begin though talk favorite ugly market today sharply one day reprieve fresh concern lie ahead money appear drifting war russia russian president vladimir putin told people u bent destroying russian homeland wednesday drafted three hundred thousand reservist threaten nuclear war bluff said china threatening united state laugh obviously crime rising across country school failing people poisoned fentanyl greatest threat facing community family child cartel two cartel mexico responsible vast amount fentanyl united state today border undefended plan disaster administration hurting entire country faced fact biden regime decided focus three priority number one find way indict donald trump anything number two find way blame ron desantis harm resulting hurricane number three try get know midterm voter choose abortion restoring prosperity safety wonder populism booming everywhere wonder watch race closer leaning democrat week ago either toss ups leaning republican want look wisconsin incumbent sen ron johnson supposedly weak position week back five mandela barnes tim mitchell essentially dead heat incumbent liberal tony evers governor race doctor oz closing mister hoodie without clue john fetterman four people waking wreckage democrat policy left behind think starting ask intentional texas state aj heard say ken paxton called border nightmare planned disaster remember even biden inauguration began flash green light central american essentially beyond mean knew right restore border restore order close trump biden opposite ditched remain mexico pa policy put carla charge ever sign white house never intended enforce border another clue intentional biden crew made abundantly clear think america terrible past informs present racism american problem get reflected discrimination housing employment justice system racism real america always xenophobia real america always sexism original sin slavery weaved white supremacy founding document principle america truly systemic cli racist brown v board education civil right movement election first black president two time system corrupt saved well answer left saved hate constitution hate judeo christian tradition hate capitalism believe need reset courtesy george soros reset discussed ad nauseum college campus davos requires complete reordering society especially american society mean thing like employment job based objective criterion merit two hundred thirty two year history u department treasury hold position making history first black woman first openly gay member biden administration first openly trans assistant secretary health get point biden cabinet top staff presiding one nightmare another offer solution action make matter worse first forget failure administration focused truly serving american people truly improving standard living safety would canned yelling treasury may orca austin pentagon granholm energy buddha judge transportation would fired month ago lead u sensible conclusion goal decline today inflation know yell ignored well market lowest point since november twenty twenty believe path succeed bringing inflation also maintaining think u would regard strong labor market god even employed supply chain mayor pete supposed address still messed one point five billion dollar going grant award across country announced today build world leading transportation system strengthen supply chain create job advance equity improve economic opportunity china move south central america even funding russia war ukraine meanwhile john kerry climate czar left begging china keep focusing climate change done china seeming reluctance participate affair climate control nation try make china interestingly enough china plan electric vehicle put road next year china rest world put together okay get drift america humiliated clip john kerry example humiliation poorer weaker way left love want create many ward state many people dependent government think left wing governor refused open covert obvious could care family young people police care family young people setting stage new normal new normal would le freedom le travel lower standard living lowered expectation remember global elite power always always find excuse take away freedom bush nine eleven patriot act course pandemic lockdown big tech censorship january six deo j domestic terror focus course cite climate change ban gas powered car gas appliance cause energy price skyrocket remember real threat feel need restrain u threatened people like georgia maloney new italian prime minister warning citizen fall domination play left want italian school teach turn student parent culture really unnerved actually quote gk chesterton could even buy chest automatically signify froggy sad even fanatical clock spot animal growing started forty year ago venus temporary via seniority similar cruelty fearless forthright well spoken triple threat like almost refuse live left liberal dictatorship idea realize none none seeing happening around bad stuff happening accident,ccciaociaofoxy_1664535760_7149126478951615787
106,meanwhile jesse ventura order sent alex piper mit tomato world renowned physicist jesse want know doctor hiding real reason afraid personally think global warming turn disgrace scientific community environmental movement dr richard lindzen say true scientist speaks global warming expect trouble environmental movement flagship know carbon trading trillion multi trillion dollar business yo science funding estimated u alone spent something order seventy billion dollar research last thing world anyone would want solve problem showed crazy train five clear evidence available around many still believe global warming problem dr linton say reason global warming crowd become defensive fact setting quarter pad temperature stopped increasing projection disaster basically folding agenda essentially raising money raising tax gaining control people life fact consumer taxpayer benefit satisfy telling saving world get high alex schwartz learn say lot people getting rich lie believe guy got reason lie paid convey professor paid mit many many people getting rich lie talking talking company like al gore r mutual fund investing talking lot different people making money government pushed thing reduce effect global warming june learn interviewed professor well known professor claim life threatened family standing lazy said believe france funding stopped donated career basically show mean powerful force silencing people clearly al gore mean face voice global warming whole time think scam dunno mean al gore friend mine hate say would tell scientist think know got tunnel vision making ton money apparently know well actually found company called hurrah basically poised microsoft carbon emission like kind carbon monitoring software every company going get al gore hatred company talk talk know going ask hard question,ccssstik.io_1673710587133
107,asher know rolling field,ccoriginalcuddles_1625026673_6979436385878936837
109,warmer many time throughout history baseline lowest carbon dioxide six hundred million year far temperature change p c c first reported ninety ninety two showed middle medieval warm period warmer present well fit marriage time nineteen ninety six report came completely contrived graph called hockey stick got rid medieval warm period little ice age instead raf flattened added,ccsashaalopezz_1662686228_7141182932047138053
112,one need know happening china right seventy day straight china experiencing extreme heat event world history reason one talking u lake river dried crop killed factory closed heatwave still raging perspective law lake bed china largest freshwater source site third largest river world top sixty six river dried completely daytime seeing temperature forty five degree celsius night even getting break hovering around staggering thirty four degree weather historian said nothing world climatic history even minimally comparable happening china right say combine extreme intensity extreme length incredibly huge area time effect something extreme going affect u sold price food fuel energy sword,ccssstik.io_1673715766597
113,message go climate denier climate denier keep scrolling seem think environmental professional like get paid say climate change real want ask know supposed reach payment public servant got student loan pay talked climate change time theory like frickin rich payment come,ccthegarbagequeen_1599435598_6869523546075335941
116,year warming climate weather different weather fluctuates day day climate refers long term trend overall planet warming climate change rate historically increase c two lead mass extinction one hundred percent agreement amongst,ccssstik.io_1673709848378
118,video looking tan climate change lie exposed lie number one global warming bad people like live svalbard florida location greatest biodiversity antarctica brazil lie number two manmade c two cause global warming modern warming period one series warming period earth experienced roughly every thousand year sun rise every day take one day blame rising sun man crazy blame man one nearly dozen warming period lie number three global warming cause extreme weather like hurricane tornado evidence show graph hurricane count showing forty two year day downtrend graph noaa showing near sixty year downtrend strong tornado ask cause wind blow heat venus plenty heat zero wind wind blow temperature difference global warming reduce temperature difference pole equator reducing storm global cooling bad guy stormy wind line number global warming cause drought ask land ever get water water ocean warmed evaporates water vapor form cloud odds possibly rain cool ocean le evaporation athens saying global warming cause drought like saying food cause starvation pet nut drought always happen normal part nature want drought order global cooling villain lie number five current warmth unusual currently live ice age interglacial call holocene long two little white thing persist poll live climate controlled ice earth history far warmer today graph last billion year temperature lie number six current level c two unusual currently live period c two starvation average carbon dioxide level last hundred million year something like sixteen hundred part per million four time current level fact carbon dioxide level fell eight hundred part per million thirty million year ago plant stressed evolved c four specie lie number seven rate warming dangerous every day los angeles citizen experience temperature variation eleven degree celsius every day climate change alarmist frightened get three degree celsius change next hundred year anyone think rate three degree celsius per century dangerous clear cobweb naga life dam turtle could outrun pace warming turtle could walk cooler climate merely month rest remainder dangerous century united nation keep talking line eight science settled unscientific thing ever heard fact downright anti science nearly two decade climate change alarmist could explain pause global warming detected super accurate satellite measurement scramble come linux excuse like ocean ate global warming lie number nine consensus researcher like cook et al australia toss data take percentage remains consensus fraud throw data find right percentage merely anti science scientific fraud lie number ten science ever done consensus notion scientific consensus oxymoron self contradictory phrase consensus mean popularity voting nothing science nz bonus lie number eleven climate change dangerous must stopped climate changing four point five billion year always dangerous global warming made civilization possible without farming would never taken hold would little rough rain many drought bonus line number twelve global warming make ocean acidic first ocean alkaline make acidic acidic first place perhaps biggest reason global warming change ph ocean something dangerous warming force carbon dioxide ocean secret behind al gore big graph inconvenient film lied implied c two forced temperature way around warming caused nature forced great volume c two ocean,ccssstik.io_1673716234639
119,hill love cat want talk geoengineering weather modification cloud seeding want say warming temperature climate change hoax caused weather modification cloud seeding let talk let talk cloud seeding geo engineering weather modification whatever would like call initially conceptualized method increase rate precipitation combat climate change word cloud seeding caused climate change hoax speak fact actually counter warming trend cloud seeding essentially cloud seeding release aerosol atmosphere controlled manner aerosol produced c water example designed act efficient cloud condensation nucleus wild term got going mean enter cloud become activated increase cloud drop number constant duration increase albedo cloud result enhanced rate precipitation drop becoming bigger mean albedo increase aerosol released crowd le sunlight going cloud instead going reflected back actually result short term cooling kind bias time work toward mitigation strategy let even get really actually counteract global warming tray fan seeing actually study published twenty twenty gaspar find cloud seeding counteract global warming fact state climate change due c two increase significantly reduced result seating const centered land region,ccssstik.io_1673717412731
122,asked even speaking night asked tanya plibersek one yes asked tanya plibersek deputy labour party potential deputy prime minister carbon dioxide big issue relation climate change said yes said well case percentage atmosphere fear made carbon dioxide said know sang know percentage atmosphere carbon dioxide yet prepared stand economy head address problem detail know explained percentage carbon dioxide atmosphere alice much alice much carbon dioxide atmosphere question scott morrison said alison climate change allows amazon something paris much carbon dioxide problem much carbon dioxide atmosphere assigning hang going argue case organized point one four percent point four u human around world create three percent three percent australia creates one point three percent one point three percent three percent one four percent decide national economic suicide,ccCópia de ___this.gal.tells.truths_1659813547_7128844893446737157
123,hey buddy banned,ccssstik.io_1673709756036
124,current south pole temperature minus twenty nine degree celsius think minus twenty fahrenheit america listened snow freezing pavement ice load deadly minnesota alone saw one hundred eighteen spin fifty rex kentucky three fatality new york declared state emergency flash freezing answer going anywhere soon going event going continue weekend windshield going absolutely bone chilling life threatening event biggest impact come bitter bitter cold day started chicago negative ten degree warm ball last one windchill make feel like negative twenty one wind back say negative ten degree negative twenty south pole fahrenheit thing southpaw seven million cubic mile ice realize common knowledge columbia ice field canada get regularly plus thirty degree celsius summer would like ninety degree fahrenheit five thousand year still even one cubic mile ice bottom line simply think minus twenty nine ice melting know south pole never receives direct sunlight average yearly temperature minus fifty cannot melt say ocean level rising think ocean surface earth six hundred million square mile rise fall two half foot every twelve hour called high low tide affected moon nasa say measure one inch sea level rise span c six hundred million square mile question critical thinking exist one south pole cannot melt next one hundred year melt next one hundred thousand year climate hoax every single prediction ever made dead wrong anyways thought,ccssstik.io_1673718456799
125,fifty degree new york city right middle january direct result capitalism decade decade fossil fuel industry lied climate change sow disinformation climate change spent hundred million dollar lobbying legislation would combated climate change like transfer,ccssstik.io_1673709036709
127,saving planet one plastic jug cardboard box time,ccCópia de ingersolldairyfarm_1643482339_7058702895516126510
128,remember remember carbon dioxide emission carbon dioxide invisible gas coming mouth moment people would say sub coming mouth well way wherever carbon dioxide zero point zero four percent atmosphere zero point zero four percent worldwide human responsible three percent little l australia responsible one point three percent three percent zero point zero four percent put decimal point like decimal signing economic suicide note issue one prepared one come program debate one cat asked leading figure labour party climate change problem infamous interview yes carbon dioxide coming year till cause sort unsure percentage atmosphere carbon dioxide hang interview percentage carbon dioxide silence still isolate percentage know know fashioning labour government fashioning public policy problem audit,ccssstik.io_1673715815471
129,climate change agenda targeting kitchen bind coming gas stove told one hundred percent certainty tell gullible completely based many news report believe true see never going see rage farming yeah federal government incense devising electric range top electric stove science suggests gas stove safe always thought think way lead pipe used safe latin paint leaded gasoline used safe especially used safe find new thing science evolves understand thing danger make new regulation people actually safe coming gas stove,ccssstik.io_1673709296042
130,family say climate change fake say real family fact climate changing family witnessing antarctic ice one melting flood around world look family dry dry dry dry dry plot flood flood flood flood family remember video spoke weather manipulation look let refresh mind changing ladder made flat look like sky china building huge radical throw machine look type weather modification even lightning mythic look family many climate change scientist agree global warming happening gregory gardner google climate change see official said climate change nasa said climate change one see climate change dc climate change full swing look look dr frederick see sixty year member american scientific community never missed witness disturbing corruption peer review process event led apcc report talking family talking one fifty leading member watch,ccssstik.io_1673708653938
131,researcher discovered pollution remote part world first time plastic particle found fresh aunt arctic snow known microplastics form pollution spiralling across globe broken larger piece plastic kind revolutionized entire industry,ccssstik.io_1673710442140
133,make global warming think classic example need crusade people many people shocked email matter shocked read read original un study year ago curious going deal question temperature went first increasing carbon doc carbon dioxide say aig,ccCópia de krissy0220_1609806644_6914066827341483270
134,example said told lot lie tonight would example nice well say like thank lack rationality cite evidence talk climate change said mankind going wiped within twenty year scientific theory sorry science would disagree scientist ninety seven percent scientist say one two degree celsius melt ice cap rising sea level mass extinction end earth change certain point ecology planet much difficult human survive consensus lot climate change denier like like ban like cleveland perpetuate liberal hoax silence saying liberal mean obviously pushed politician primarily united nation like tex politician going push political issue right politics science point take science say study citing ninety seven percent number around long time al gore used movie one issue first science made consensus second question asked broad question whole array scientist many expertise climate whatsoever use consensus number especially one old manipulated politician think really getting point take poll figure scientific data think world going end twenty year pollitt thought said thought going change certain point human habitation difficult vastly different doomsayer idiot old figure ongoing right know figure decade old right ninety seven percent figure decade old,ccssstik.io_1673709800982
135,talking walking around people giving whole head rather walk avenue insight slogan employee record record question motif dj played record percent voted understand know kid say predicted effect,ccCópia de espartaco888_1660751153_7132871826337926446
137,hot closed door trying cool whole wall cool whole world way yes hi intergovernmental panel climate change particular know cure global warming,ccssstik.io_1673709780883
138,love make porn woman difference hang lance hub yeah taught,ccmariaziffy_1620924379_6961817182061808902
139,code slow speed one point five knot two large vessel ocean caching floating ocean plastic along way barrier extends three metre surface completely open center allowing fish escape simply swimming barrier water flow system plastic get pushed center act like collection area ocean cleanup call retention zone,ccssstik.io_1673708278814
142,abstract know rolling field,ccCópia de originalcuddles_1625026673_6979436385878936837
143,solange laid bathroom shit,ccceasargrappo_1613770639_6931092071335922950
